REVIEW,REVIEW TYPE
weekend visit actually place nice peaceful spend time good poor get nice food eat also nice parking place inside temple premise people visit bangalore must visit place people living bangalore must also visit weekend enjoy visit working day,POSITIVE
wonderful place seventy peace beautiful temple painting architecture nice seriously doubt massive building required place worship donate place money used establishing building bigger temple,MIXED
devotional visit lord krishna always crowded devotee ca escape rush kind far away city morning evening parti training even buster temple,POSITIVE
place devotion place devotion worship lord krishna peaceful place helpful handicap wheel chair facility,POSITIVE
holy place nice clean holy place temple lord krishna managed well icon group ideal place getting peace mind amidst bangalore town,POSITIVE
oasis solace gardening bangalore traffic crowd icon temple indeed oasis extremely clean well maintained love spend time much better trailing around mall reason,POSITIVE
hare krishna temple learn ritual worshipper krishna first temple making step chanting mantra getting environment go second temple climb third want give donation make puja ritual blessing prasad poster book included sit middle room hear music people watching mediate leaving shopping restaurant veg eta super pure,POSITIVE
big temple must see visited couple icon temple europe size temple comparable temple fact comprised smaller temple one big temple visited donation r brought u gift including book religion noted need appropriately dressed visit temple happen dressed short dress rent long skirt r r deposit,POSITIVE
arena supreme personality coxhead loved go everyday pleasant peaceful environment amazing temple bangalore even temple well maintained love lord,POSITIVE
impressive gold shrine deity ceremony photo allows inside pay admission store shoe,NEGATIVE
amazing loved place big quiet peaceful could spend day enough look really beautiful also quiet interesting even interested know much culture like place learn something go came ritual happening ca tell enter leave shoe door also could take camera inside bother allowed focus whole experience still sure place free someone sold ticket prayer talk one master temple think necessary enter however expensive glad could donate something place also place temple get food drink,POSITIVE
experience invited indian colleague temple membership advantage filter long stroke checkout pushed walking temple endless line people temple built th affiliated hotel restaurant wohlfahrtskueche numerous souvenir shop inner part temple impressive interesting numerous szeremonien,POSITIVE
spiritual visited temple thinking wee walk around looking lovely architecture wrong guided though two smaller temple climbed stair main temple took part krishna service spiritual although hit donation end bring u back earth,POSITIVE
miss bangalore temple miss gaudiya vaishnava temple located rajajinager north bangalore one largest icon temple world well worth visit impressive main shrine beautiful icon magnificent open religion none fastrack area foreigner great u tight sightseeing schedule one incest temple visited india well worth visit dont miss area,POSITIVE
beautiful temple beautiful temple ground prepared remove shoe enter ground bring appropriate sock temple living temple daily service people worshipping also welcoming guest visited september,POSITIVE
peace song upon entering site temple built soon becomes clear entered dimension structured organized accessed obviously without shoe temple india strictly following planned route get marshal main room orderly manner modern compared traditional temple many interesting statue god main room magnificent almost touching lucky watch puja stay listening devotional song take place inside carry exit lower floor wind series banquet shop buy everything end air restaurant truly exceptional taste cleaning exit overlooking fountain sacred food taste highly recommend visit,POSITIVE
huge fascinating temple well kept huge temple runner hare krishna movement great food handicraft connected temple,POSITIVE
icon icon indeed iconic place visit one bangalore famous serene temple visit family forget visit exhibition area famous canteen serve delicious hygiene snack food made kitchen,POSITIVE
nice place visit nice place visit understand country culture neat peaceful place must visit bangalore,POSITIVE
awesome ever seen krishna temple lik,POSITIVE
inspiring visit great experience visiting temple first go smaller shrine idol entering magnificent main temple definitely go vip pas otherwise wait heat hot stone hour least poor european foot used main hall enough time experience chanting worshipper idol go various store book moment food detract spiritual experience get,POSITIVE
devotional one pleasant place hang evening franz family temple truly devotional atmosphere near idol like mall cum temple good,NEGATIVE
good temple peaceful nice temple like donation box sell suvinior inside good many stair,MIXED
modern temple superb spiritual trip icon must india place spirituality devotion commitment temple puja performed something experience clean environment systematic ques marshal something amazing visited temple time bangalore perfect place relax learn life meaning another landmark must visit life time attached image convenience om,POSITIVE
good temple good temple middle bangalore nicely maintained organised might little rush festival close metro station,POSITIVE
nicely maintained modern facility give real peace although surrounding area posh busy close world trade center orion mall one start getting peace mind right moment get icon premise parking space management good temple cleanliness guiding devotee queue atmosphere inside main hall par addition find huge lot religious stuff buy delicious snack eat inside temple,POSITIVE
shopping complex temple temple inside complex small one one main temple every stage temple would asked buy vip pas etc mandatory temple visit end half hour begin shopping complex disgusted level commercialization temple samoa kachori clothes agarbattis sold look like shopping complex know people get peace mind,NEGATIVE
best place visit bangalore anyone asks would suggest traveler visit bangalore first would say icon temple place well maintained systematic one get good feeling every religious place follow devotion would come automatically reach main temple place inside huge complex separate line physically able person also separate shopping area food court,POSITIVE
big isbn temple temple big visit one time go bad point make temple like business point space us selling product,MIXED
temple india clean beautiful serene mystic thats place feel closer god place,POSITIVE
serene moment enter temple premise hear hare krishna chant fill heart load peacefulness would recommend go via step get complete experience visiting icon temple nicely maintained premise,POSITIVE
impressive krishna temple bit city massive krishna temple foreigner impressive see big temple attracts thousand people everyday also interesting see commercialized krishna movement dvd book etc buy,NEUTRAL
made sharma temple peaceful place visit near yeswantpur railway station easily availability auto cab,POSITIVE
interesting huge temple need prepared leave shoe entrance share floor thousand suggest pay fee go vip path cloud way taste food end enjoy free sweet get soup go put,POSITIVE
bad used kind temple look like palace beautiful also something missing,MIXED
love krishna icon one wing activated moment perfect holy place devotee especially people travel dwaraka mature vrndavan,POSITIVE
peace world went invited session wedding anniversary lovely ban great prasad afterwards made desi hee pure vegetarian,POSITIVE
superb temple bangalore please take care quality food,POSITIVE
rated temple surely non believer went evening able visit temple without participating crowd poor good practice temple kind visitor,NEGATIVE
gr temple krishna devotee multiplex temple people may feel commercial icon promotes krishna consciousness every mean date theatre static diet restaurant distribution book still prabupada radhakrishna poster must visit arena devotee chant hare arena happy,POSITIVE
excellent temple temple big gt really big temple canteen good delicious prasad many shop inside temple buy lot thing related lord krishna lot book also available many language,POSITIVE
nice place,POSITIVE
wonderful whole family temple though beautiful temple practise stepping stone towards idol hare krishna chanting work wonder one spiritual awareness help devotee truly concentrate purpose visiting temple idol awe inspiring whole hall beautiful sitting listening people singing chanting hymn brings peace melee marketing marketing book souvenir food sweet family kid elder everyone enjoys part experience went law parent three kid enjoyed temple snack beautiful outdoors complete fountain mushroom difficult find temple premise little complicated navigate would better check direction soon feel unsure wonderful experience visited june,POSITIVE
nice device experience went parent experience quite device never expected big place mid city temple quite humorous really systematic clean properly managed temple committee overall nice smoothing place mediate pray,POSITIVE
evening imposing orion mall mall bengaluru walk minute even india largest icon temple ordo mall also avoid lot riding lara wearing taxi wear away say want take tear described road good people evening seems imposing beautiful beware beware weekend navigate crowded weekday possible,POSITIVE
must visit isbn isbn one best temple bangalore best time visit noon around weekday find le rush also good restaurant inside offer excellent food visited november,POSITIVE
god khichdi offer peace quiet would want temple also offer khichdi prasad tasty,POSITIVE
great place worship take photo inside definitely experience remember many people lined normal taking shoe washing foot long walk temple get good idea people worship serve get paying respect much food available purchase free make sure come clothes revealing try cover entrance,POSITIVE
believer temple ser eindrucksvoll modern und professional gef hate angle mit hover kommerzialisierung overall sind u tzliche spending auf glichkeiten der eintritt ist kostenfrei f r schnelle abfertigung bei warteschlangen wird eine web hr verlag,POSITIVE
happy place love thr architecture design place first step begin journey spiritual bliss much peace place yes commercialized sort way avoid painted ceiling main sanctum beautiful similar krishna temple mature,MIXED
good place went full family icon temple near yeshwantpur mantra mall enjoyed like anything,POSITIVE
silent place stay forever nice place explore,POSITIVE
beautiful temple one bangalore one amazing isbn temple among one visited whole audience beautiful beautiful idol lord krishna even chanting hare rama hare krishna time actually beautiful experience two time experience truly worth,POSITIVE
best place get peace temple twice good temple nice go family friend sure get peace,POSITIVE
krishna temple temple famous bangalore temple situated near mahalakshmi layout one climb stair never miss temple,POSITIVE
amazing place feel much peace divine power spirituality touch hare krishna,POSITIVE
nice temple rada krishna temple peaceful nicely architect get delicious veg food canteen,POSITIVE
heaven earth nice place every weekend prefer go temple early morning parti like heaven come earth plan come bangalore please visit awesome experience,POSITIVE
beautiful complex fantastic welcoming lucky driver day would give incite ritual seeing although religious slightest always interested seeing custom place visit temple great place start visiting bangalore,POSITIVE
cognitive dissonance long entrance line check shoe large bag allowed temple get token retrieve later required wear appropriate clothing includes neither shoulder leg visible done due diligence showed short selling ticket rupee apparently needed special access ticket different people told would supply appropriate garment sure enough luggage shoe check entrance rented wrap around cover leg rupee rupee refundable deposit appreciate available wish respect place worship people helpful friendly showing tie wrap around odd line along different path visitor special entry pas allowed viewing separate area participation short ceremony included hand washing touching flower changing also included couple gift including dummy snack book written kannada box opened yet early visit strong feeling cognitive dissonance later tour explicit issue identify caused feeling started specifically main tour area signage explaining krishna religion two struck one fish beach chair labeled fish water definitely identified fish another explained material thing could lead happiness clear thinking passing area passed extensive set gift shop shopping area food sale ever seen religious institution towards end odd juxtaposition sign paid lunch others free lunch end offering free bowl type partridge feel offended accepting point anxious leave temple really outstanding piece architecture people seemed genuinely friendly helpful mm,POSITIVE
nice temple hidden residential complex ofrajajinagar happened visit temple chance must say mesmerized lordkrishna idol main temple also painting done inside temple good visited july,POSITIVE
perfect mix tradition modernization icon temple must visit visited local traveler hence crowded need atleast hour good marshal seeing place minute quite number step however manageable normal traveler private card go upto specific point better avoid camera keep authority specific starting point one toilet sorting point directly exit point chapel also need stored however done systematically without kind problem great architectural work also read history queue main idol huge main hall called hari naam iran icon temple idol beyond word marshal many place shop souvenir frame bag clothes book etc best time visit,POSITIVE
create place great piece art nice place great experience temple clean neatly maintained must visit place,POSITIVE
icon good experience western escorted icon temple indian colleague visiting bangalore july business eye awe inspiring place honest quiet tumbling visit seemed christian western amongst mass hindi pilgrim lot lot smart schoolchildren obviously taking visit term time child seemed take great interest polite embraced opportunity speak guy england parent teacher proud peaceful place even queue stepping stone people chanting hare rama hare krishna step inside beautiful place solid gold alter adorned flower say tumbling experience exit large outlet selling souvenir snack bar restaurant pleased able visit great attraction advise anyone uk usa visited july,POSITIVE
blessed feeling visited temple week day lovely experience sun went stepped inside huge hall sound bhajans filled air peaceful feeling stand deity forget sit time floor mediate,POSITIVE
holy city within city wow first thought would come mind soon see graceful temple sens come halt soon step inside main shrine feel like heavenly abode hand leg washing facility provided entrance bag footwear supposed stored visit temple least hour spare amazing deity exhibition temple infrastructure shop sell krishna deity accessory devotee also eater near exit temple serf south indian delicacy,POSITIVE
powerful icon temple bangalore great place busy day one id happy see power devotion towards sri krishna part india long ago serious dispute various function society seem solved temple beautiful made well managed place one like good crowd management temple reflects http www tripadvisor showuserreviews g r icon sri rada krishna chandra temple bengaluru bangalore karnataka html,POSITIVE
great experience expecting interactive welcoming visit open experience enjoy tourist outside india remember dress appropriately arm leg covered men woman cover deposit fee happen show unprepared temple bangalore allow shoe inside prepared barefoot walking around inside,POSITIVE
temple visit situated main tumour road vary big temple lot stair statue nice worth visiting krishna lover,POSITIVE
serene peaceful place blissful place spend time self divine visiting soon lot parking space well managed temple great tasty prasad food item many variety locally made gift home article family well,POSITIVE
great temple hare rama hare krishna international society krishna consciousness icon temple bangalore city huge cultural complex inaugurated one best temple bangalore modern technology adapted construct temple arrangement neat clean however one must visit experience great temple magnificent complex blend tradition modernity symbol dedication devotion icon cause haiti service architectural landmark,POSITIVE
icon temple bangalore peace mind guaranteed,POSITIVE
awesome spiritual place,POSITIVE
lovely peaceful place heart crowd place mediate forget cumbersome task life peaceful place made city help control effect modern lifestyle,POSITIVE
wonderful holy place true devotional feeling around temple feeling lucky visited beautiful temple rada krishna,POSITIVE
unique experience deepotsava celebration atmosphere exhilarating place meal site well shop devotional material,POSITIVE
relaxed place busy center quite modern temple nice experience place peace busy city bangalore nice view city,POSITIVE
peace love hara krishna early morning visit chanting spiritual entertaining time lovely site enthusiastic crowd,POSITIVE
commercial crowded commercial maintained premise well place feel commercial peaceful marshal end going busy day feel rushed,MIXED
special marshal birthday feeling blessed birthday visit u given privilege right front mesmerising statue god seeing every tiny detail beautiful springer worth chanting dancing lord name strong vibration felt soul felt heaven lord present surrounding within,POSITIVE
make mind say icon everybody know name enough place good amazing best part idol lord krishna wife architecture unbelievable enter temple feeling cant expressed proceed outside disappointed temple business going back name lord krishna pure business,MIXED
nice temple architecture went temple evening time temple architecture good feeling like temple many merchandise shop side temple except temple okay time pas,NEUTRAL
commercial spiritual place bad experience request force try smart approaching donation poor fee etc sad,NEGATIVE
beautiful spectacular saw vip entrance money lost free charge myrmidon difference rest lineup describe,POSITIVE
good decent silent place better go family,POSITIVE
one best temple bangalore visit good atmosphere,POSITIVE
dear people kind attend temple good timing worst management even allowing de,NEGATIVE
icon temple bangalore visited family felt good came back temple one must visited place bangalore,POSITIVE
must visit good temple good vegetarian food made organic ingredient surprised see temple clean nice,POSITIVE
wonderful clean temple ever seen life place right middle busy place enter temple feel different world well maintained place place peace loving people course spiritual marshal god swine away worry bring back happiness,POSITIVE
mind icon temple bangalore one best hare rama hare krishna temple visited lord krishna every say excellent mean decor temple infrastructure cleanliness temple staff behavior discipline security etc far visited icon vrindavan delhi mumbai kingur hardware bangalore found bangalore organised others learn,POSITIVE
enter temple get lord narasimha lord bahai temple big hill get see lord k,POSITIVE
place feel personal presence lord krishna place filled spiritual energy place feel like spending every moment life word enough describe experience personally visit know exactly feel experience highest form divinity,POSITIVE
place feel personal presence lord krishna place filled spiritual energy place feel like spending every moment life word enough describe experience personally visit know exactly feel experience highest form divinity,POSITIVE
heaven earth,POSITIVE
peaceful place visit visited lot time isbn visiting place feel peace mind one theater available see video lord krishna finally get lot food item eat,POSITIVE
rada krishna temple located bengaluru largest isbn temple india place peaceful calm,POSITIVE
nice place one time visit nice place visit good maintenance organized marshal would better commercial complex marshal,MIXED
nice place,POSITIVE
many time,POSITIVE
grand temple pretty statue mall one grand temple bangalore setup dress decoration idol inside temple pretty shopping mall start soon leave premise main sanctum selling anything everything name krishna long queue snack counter generally interesting thing available handicraft shop still best value money artifact book specially translation ita available isbn book store parking weekend could challenge reach early avoid traffic,MIXED
na peaceful place,POSITIVE
na best temple temple beautiful clean lord shining ever loved food item tasty pure entry exit well management,POSITIVE
great place,POSITIVE
great masterpiece bangalore,POSITIVE
termed super facility multi branded mall,NEGATIVE
visit friend family twice one time friend second time family atmosphere good thing like forcefully send u way exit lot stall give feeling visited mall instead temple,NEGATIVE
awesome view main temple temple big view main temple amazing lot option eat done religious offering,POSITIVE
beautiful place visit bangalore experience top view bangalore mountain type temple,POSITIVE
,POSITIVE
impressive temple follower hare krishna appreciated fervor follow lovely temple,POSITIVE
art structure beautifully designed big temple awesome idol god seems god standing live threat thing paid many shop rather god taken place temple must experience,MIXED
amazing experience amazing place find peace busy city feel divine connection inner universe inside big structure clean spiritual,POSITIVE
sri krishna hare sri krishna temple awesome outlook went bangaaaallore day trip september good aa nice experience,POSITIVE
one famous must visit temple bangalore located main road temple easy locate parking might problem huge crowd weekend festival,POSITIVE
must visit place bangalore visited place family winter vacation last year temple management really good aspect starting footwear baggage counter marshal queue visitor world coming throughout year marshal delicious prasad think prasad highlight visit kid adult,POSITIVE
clean beautiful must visit bangalore trip nice clean sit mediate small stick snack available inside temple bought souvenir,POSITIVE
half temple half shopping place temple beautiful view nice main hall try exit need go temple shopping mall floor missing spirit side foreigner,NEGATIVE
beautiful temple beautiful temple middle city went recently second trip past one year temple organized security keeping footwear climb step reach temple reach parti timing enjoy temple check parti timing icon website nice experience took flower coconut banana sold icon deity return given exiting main hall atmosphere extremely smoothing must visit bangalore,POSITIVE
nice,POSITIVE
peaceful disciplined,POSITIVE
well organised,POSITIVE
visit icon temple place must visit ever come bangalore love audience prasad place easily accessible public transport,POSITIVE
peaceful atmosphere,POSITIVE
best made made temple famous relaxed religious temple temple define city knowing temple visit must family single double anything every body like sure listening story lord krishna krishna birth amazing http www tripadvisor showuserreviews g r icon sri rada krishna chandra temple bengaluru bangalore karnataka html,POSITIVE
peaceful place overhyped nice temple neat clean amenity beautiful architecture think place overhyped pay visit peaceful moment like hindu temple,POSITIVE
must visit visit bangalore something place purity essence place feeling back really worth spending evening heavenly touch,POSITIVE
sri krishna temple temple located city near yeshwantpur built large area famous lord krishna idol many foreigner visit temple blessing,POSITIVE
spiritual feeling nice visit although never ending gift shop may put people try food shop amazing,POSITIVE
surreal experience first time visited icon temple coincidentally also start deepotsava friend find seventh also participated commemoration deepotsava shared mind blowing blessed experience temple feeling blessed part,POSITIVE
beautiful serene calm place architecture good temple premise full devotional flavor exit route many stall seem spoil spot though hard time figure restaurant serve nice sagvis buffet meal darshanam prasad queue went little managed despite effort management staff,POSITIVE
huge vibrant temple visited icon bangalore romaji nagar temple dec big temple moment enter temple premise get enthralled hare krishna hare ram mara top section shri krishna rada mandir lower section commercial devotee buy various book icon calendar item also lot variety food item eat carry daily prasad veteran also done devotee overall good place spend quality time god family,POSITIVE
temple fine dine one icon temple fine dine temple well maintained alliance cleaner taken top priority select food like end marshal variety food kept sale prasadams temple heaven love bird want spend,POSITIVE
really beautiful top small hill really beautifully built shaman ending day worth listening,POSITIVE
hi,POSITIVE
peaceful clean temple peaceful clean temple one would see india approach main temple well organized separate path temple located small hill top except area path narrow may manage big crowd way main temple first come srinivasa godina prahlada narashima sannadhis main temple srinitai gauranga srikrishna alabama sriradhakrishna chandra god dharma one would step large number stall including bakery felt many number close main temple looked odd next come prasad annadhanam distribution one climb temple exit least one hour two hour case elder required cover temple,MIXED
