REVIEW,REVIEW TYPE
beautiful krishna temple bangalore nice place bangalore good see lord krishna temple shopper inside get gift good book sweet snack much enjoyed lot temple,POSITIVE
awesome arrangement devotee great improvement last visit double thumb,POSITIVE
icon temple good temple good temple rada krishna interior covered gold main entrance way sanctum sanctum made bit lengthy queue complex could avoided many temple one among owned icon visiting choice temple,POSITIVE
expand thou icon spread grace almighty mind ruined kai purify,POSITIVE
nice place visit friend family,POSITIVE
beautiful temple clean well maintained many people come offer prayer ample space parking top hill one see city bangalore highest point,POSITIVE
simply divine,POSITIVE
nice place visit bangalore beautiful temple peaceful devotional atmosphere,POSITIVE
good commercialization krishna,NEGATIVE
location good view top amazing well maintained spiritual place love always,POSITIVE
wonderful cuisine restaurant unexpected pleasure branch market restaurant famous landmark icon fine job providing clean religious tourism devotee visitor alike must see destination honest/humble opinion visited december,POSITIVE
icon bangalore yashwantpur well managed beautiful place evening parti excellent try reaching pm stay till parti palace usa complete good food temple canteen also,POSITIVE
holy place visit temple found spiritual peaceful temple gratis amazing one find item food shop available within premise temple must place visit,POSITIVE
part city excursion disciplined systematic marshal prasad great place also pure vegetarian restaurant food awesome,POSITIVE
good spiritual palace,POSITIVE
huge temple seen many temple icon india one biggest ever seen one mumbai considered biggest one extended bigger huge temple beautiful must visit place bangalore,POSITIVE
must visit temple bengaluru well maintained spiritual chant around even pond clean prasaadham also tasty,POSITIVE
serene blissful environs akshaypatra largest free serving kitchen program run icon world,POSITIVE
le temple shopping complex temple beautiful outside well inside idol deity equally magnificent first stair temple till deity feeling spiritual even exit main hall harbor see shop abundance forced go least two floor huge shopping complex come temple went thinking temple came utter dis satisfaction seeing huge commercial activity inside temple planning visit temple please try avoid icon bangalore,NEGATIVE
great place soul except last part people love appreciate architecture like search soul right place think strongly disliked campaigning indian lord coffin box pencil box etc build huge temple lord clothes cricket bat bedsheet etc felt like krishna mall,MIXED
evening visit icon temple thing specific expect place go get inner peace well maintained specific visiting hour thing become little challenging complete whole circle round want go inside get ladder prasad good,POSITIVE
mental calmness pleasant alliance icon temple many time always like place feel time well spent time went senior citizen family opted take lift service wa slate evening tuesday delighted see directly took u main temple top final apart talk data start weekday many people like weekend got enough time close view proceeding poor came lift introduced another exit regular visitor take counter article hardly spent time spent temple time well spend maximum happiness satisfaction,POSITIVE
best temple bangalore beautiful temple superb painting inside temple one chant hare rama hare krishna visiting temple marshal one shopping idol photo book dress bag also many counter snack variety food item good parking space available temple premise must visit place outsider visited march,POSITIVE
hare krishna love place hare krishna hare hare,POSITIVE
well maintained calm quiet place weakness maintained everywhere liked atmosphere system sat inside temple comfortably long time volunteer cordial supportive visited december,POSITIVE
excellent created divine atmosphere well organized possible eating outlet inside temple complex reduced minimum,POSITIVE
god poor child mid day meal bangalore,POSITIVE
beautiful maintained temple best visiting time pm pm,POSITIVE
really nice temple clearest temple ever seen,POSITIVE
one find peace atmosphere awesome well organized maintained,POSITIVE
must visit place bangalore one best attraction bangalore ever visiting bangalore must visit place visited family friend also mix spiritual commercial place buy hand craft,POSITIVE
wonderful icon temple hilltop visited temple number time always feel good atmosphere little bit crowded pleasure visit early morning atmosphere quite different really give different feeling like love place guest house facility family wish stay paying small donation life member may stay three night free cost one interested may try test mr chatterjee manager receptionist guest house helpful friendly ready help best guest,POSITIVE
icon must visit place bangalore visit good place visit parent relative calm clean temple maintained western listen chant hare krishna hare rama temple prasad tasty specially postal shop shopping get different kind food stall started visiting temple,POSITIVE
icon bangalore gift hd still prabhupada preaching lord chaitanya message modern technology following instruction quota vairgya principle still upa swami,POSITIVE
isbn temple good money give temple money going usa,POSITIVE
amazing hare krishna,POSITIVE
divine beauty worship temple stay bangalore place twice place perfect family tour thing visit temple variety material related puja item lunch akshay para suggestion reach place morning get enjoy lunch akshay para,POSITIVE
ethnic place culture really beautiful place get enlightened holy shri krishna morning marshal especially smoothing mind saatwik food prasad great delight see,POSITIVE
excellent mall one best mall ever seen life temple converted wisely mall better orion mall laughing loud,POSITIVE
hare krishna hare krishna krishna krishna hare hare hare ram hare ram ram ram hare hare good place nice prasdams gun place meditation best time visit evening one clearest temple visited calm quiet atmosphere fill air chanting hare rama hare krishna,POSITIVE
good,POSITIVE
nice place go got hour kill,POSITIVE
well maintained appreciated,POSITIVE
shopping center ca come directly temple must pas shopping center take minimum hr come,NEGATIVE
chant hare krishna hare rama good calm place crowded small difficult park car outside peaceful inside city,POSITIVE
spectacular temple scenic view situated hill overlooking western part bangalore icon temple must visit tourist resident alike beautiful idol inside temple wonderful place visit entire family visitor please note temple open specific timing closed afternoon,POSITIVE
must visit visitor bangalore premier temple krishna worshipper clearest one biggest temple find karnataka organisation also caters free food school child enjoy nice vegan lunch premise well small price plan advance take look calendar ensure festival day visiting,POSITIVE
well kept wife wedding well clean well kept environment good experience tip icon member use card get discount stay wedding hall,POSITIVE
spiritual extravagant must visit place visiting bangalore good place visit visitor home elderly love unlike temple temple extravagant spend hour place serene spirituality main sanatorium helm better avoid place evening weekend get overtly crowded entry free special marshal special entry added cost recommended case interested place shop buy book picture cd souvenir overall must visit place visiting bangalore,POSITIVE
famous krishna temple icon temple one famous lord krishna temple bangalore gone icon temple temple nice,POSITIVE
magnificent temple icon temple bangalore large one mix modern old architecture temple clean possible despite quite large daily football tranquil environment felt spending time main prayer hall,POSITIVE
great visit icon bangalore,POSITIVE
nice place peace reaching place convenient bus metro cab etc beautiful neatly maintained good visit anytime,POSITIVE
place great food yes right also good worship beautiful temple one biggest royal temple world feel great pressed time please go thru chanting line take long time go empty stomach free prasad lip stacking also huge spread food stuff end temple get great food believe large variety food temple enjoy,POSITIVE
icon good temple bangalore city,MIXED
clean professionally managed temple visited temple birthday since one patron send invitation one week hand confirm telephone day earlier whether visiting morning evening allowed person year family visited reached main temple though lift wheel chair facility also available promptly security reception person help one swamijis welcome temple notice put next puja till make sit comfortably even chair chant rama rama rama rama krishna krishna krishna krishna japamala sharp swami take front paris come ceremonial waking deity swami guide lord narashima godina temple puja main temple special puja archaic done family birthday devotee together theertha given given water wash hand towel wipe great guide dining hall heavy breakfast swamijis make chant loudly breakfast though coffee served serve hot adam milk everything minute minute punctually done guided silently shouting pushing peaceful atmosphere worker wiping grizzly drop slip marble floor,POSITIVE
nice morning visit leave shoe car shopkeeper rupee pair enter free unless want buy offering blessing ignore man hard sell ticket rupee also leave camera car security check men woman entering mobile phone ok camera walk enjoy built may plenty opportunity buy hare krishna publication buy vegetarian cookbook excellent instruction american w measurement rupee bring appetite many food vendor within temple complex get snack sweet rule parking glad visited,POSITIVE
peace mind,POSITIVE
one biggest icon temple generally like architecture beauty structure icon temple across india make point visit temple present city travel second visit icon bangalore one major big one city near scandal soap company near metro nearly orion mall temple well maintained tirupathi bahai prahaladha narasimha deity apart main deity krishna good parking facility main temple wonderfully architect always icon lot stall sale book stuff book stall near marshal place could avoided free movement pilgrim marshal also free prasad place little crappy queue get formed stair free lunch token provided go afternoon time,POSITIVE
wonderful experience like world biggest painting,POSITIVE
peaceful,POSITIVE
best place bangalore peace,POSITIVE
best place visit city life used visit monthly twice swear best place want get peace city life,POSITIVE
hare rama hare krishna awesome place krishna devotee great alliance place kept neat lot memorabilia easily accessible road must visit visiting bangalore,POSITIVE
liked good management nice,POSITIVE
divine place good meditation spirituality commercialized,NEUTRAL
cool place cool place visit spend couple hour divine sound whispering around temple seems krishna complex rather temple,POSITIVE
neat clean commercial space minimized library started devotee child play area also suggested,POSITIVE
like much,POSITIVE
peaceful place like peace sitting almost hour could sense positive energy popping inside believe god often temple went could feel stress release think happened due smoothing environment,POSITIVE
icon temple bangalore well organized hindu religious temple along family member visited temple donation r prasad discount coupon given adjusted purchase book bought one krishna book free prasad given nice stall purchase various material grand feel somewhat collier material good quality,POSITIVE
temple store temple inside interesting get maze shop carry item th time seen something likely give,NEUTRAL
icon temple krishna temple must visit attraction built hemlock huge place well kept wonderfully managed eating place restaurant great family visit child take back sweet prasad forget service kitchen akshay para,POSITIVE
great place everyone religious must visit whether religious went family sunday morning april religious religious beautifully built temple make feel peaceful made chant step patiently waiting long queue devotee reach inside sit hall feel quiet nice come feeling happy religious beautifully managed place see great process used control large crowd one pushing talking lettering made chant step take one step time come feeling happy learnt thing two religion,POSITIVE
beautiful commercialized place magnificent look enter hear constant chanting feel good one sit inside temple peaceful lot shop sell book organic food item many decorative item also special queue expensive,POSITIVE
many shop coming temple way come look commercial,NEGATIVE
religious place nice temple bangalore icon temple place visitor temple nice well maintained view also good,POSITIVE
best temple bangalore,POSITIVE
institution come know lowly really reminds every moment one strictly sincere follow instruction still prabhupad devotee reach platform one understand real meaning virtue,POSITIVE
family visit icon awesome nice place visit serene calm weekend b slightly crowded still manageable miss prasad,POSITIVE
calm relaxing climbing hill chant along sanctity beautiful inside temple wonderful outer view twilight certainly refreshing moment one visit,POSITIVE
nice breeze place visit coming chennai overall good experience visiting bangalore beautiful location nearby visited alba fast moving day,POSITIVE
completely commercial le faith marketing icon temple guided predetermined path take prasad religious literature idol finally food item make experience worth atmosphere created chanting hare krishna hare krishna krishna krishna hare hare hare ram hare ram ram ram hare hare time step one stepping stone lead main shrine even gallery depicting icon came ignore commercial aspect temple worth visit,MIXED
best temple lovely beautiful temple must go city beautiful temple nice approach bangalore prasad really good neat clean prefer time go evening early morning often keep going food court better improved stall good collect home stuff,POSITIVE
commercialized divinity find food stall inside temple selling almost anything serving pra,POSITIVE
beauty full place visit loved,POSITIVE
piece full,POSITIVE
nice place pray,POSITIVE
holiness commercial flavour first best place visit beauty well timeless temple small hemlock either drive top walk either road step best thing cleanliness well decoration deity visiting main deity need walk commercial shop run icon team collection huge well cost nominal spend good time shopping different show available like sound light etc nice worth watching thing missing holiness,MIXED
guru kurnool district vital super please bengaluru,POSITIVE
divine place icon temple hare krishna hill near mahalakshmi layout bangalore always busy road parking facility available temple premise need pay handicap entering premise also go normal security check ups hear chanting word hare rama hare rama rama rama hare hare hare krishna hare krishna krishna krishna hare hare enter narashima temple go srinivasa godina temple really feel divinity feel peace inside heart main temple sri rada krishna temple pool offered everyday even sit worship beauty rada krishna taking time moment ca expressed word purchase many devotional book cd dvd poor item dress food item small theatre inside little krishna life want offer sea know detail icon go official website sri rada krishna temple http www iskconbangalore org miss opportunity visit icon temple bangalore,POSITIVE
nice temple visit,POSITIVE
best isbn temple,POSITIVE
hare rama hare rama rama rama hare hare hare krishna hare krishna krishna krishna hare hare,POSITIVE
,POSITIVE
one best place visit bangalore,NEUTRAL
beautiful place worship krishna,POSITIVE
amazing place krishna devotee others might appear commercial place,POSITIVE
dot like anything dot hv faith god pk nazi della,NEGATIVE
powerful big temple lord krishna,POSITIVE
lord krishna abode must visit place visitor bangalore restriction based religion culture anybody visit pray god wonderful architecture well maintained,POSITIVE
hare ram hare krishna krishna devotee stay near icon temple visited number time guest come house krishna temple small hemlock one star attraction bangalore decoration around main deity amazing sit time leisure like typical temple offer flower perform abhishek really amazing amount snack including cake available finish marshal number stair elderly person take care car drive inside temple top lot crowd ekadashi day half kilometre icon beautiful human temple worth visiting,POSITIVE
first word utter glory krishna ultimate charisma eternal beauty atmosphere,POSITIVE
icon bangalore teach live life truly,POSITIVE
awesome place feel relaxing inner peace filled body awesome shaman titan would take anyone divine follower dance awesome felt close divine,POSITIVE
nice big temple nice place spend time family beautiful infrastructure must go bangalore,POSITIVE
hare krishna hare krishna krishna krishna hare hare hare ram hare ram ram ram hare hare,POSITIVE
feeling blessed,POSITIVE
good place peace mind,POSITIVE
loved place,POSITIVE
good going shopping go difference found spiritual thing,NEGATIVE
peace,POSITIVE
hilly location temple add beauty view city top beautiful parking ample convenient tip leave footwear car save time footwear safer,POSITIVE
rejuvenate icon bangalore nice place far center city commercial feel reduced irritated genuine follower spiritually inclined person see many shop around main place worship even prasad sold free sheer provided end never ending market inside temple basically look place earn money sell book food inflated price people provide place worship,MIXED
overall good experience went icon gap almost year sure experience last time time seems good first thing first ample parking need worry one somehow reach beating traffic bangalore way constructed four temple one visual treat main temple lot place sit enjoy spiritual music follows marshal something many people may like fine first one necessarily go spiritual book stall one see lot food sale like mall opinion complain temple authority mention top free food served end really happens people get excited looking lot food option end eating appetite enjoy delicious free meal overall good experience,POSITIVE
great outing group great place go worship fun big hall lord krishna statue good place sit minute feel peace buy lot souvenir related lord krishna ample food stall well feel hungry,POSITIVE
temple different attitude indian slight inclination towards religion course would aware icon stand probably might visited one center already case nothing special see except exceptional kitchen veg restaurant fall,POSITIVE
spiritual place must visit believe spirituality place ideal one must visit time bangalore,POSITIVE
visited twice bore serene,POSITIVE
shower spirituality visitor bangalore must visit atleast enhancing name krishna continuously make whole atmosphere spiritual evening view sunset top temple really beautiful memorable thing temple glimpse temple glass opposite main statue overall good experience,POSITIVE
beautiful temple bangalore really gorgeous beautiful temple bangalore offer attractive religious view touch heart icon temple book cab bharat taxi making available taxi service entire city bangalore,POSITIVE
magnificent structure temple look marvelous stunning one enjoys chanting calmness inside temple may shop buy spiritual book,POSITIVE
devoted evening one best place devote ur chilling evening fine weekend beautiful rada krishna sculpture curtis must go fr bangalore visited person,POSITIVE
good clean surroundings infused calmness towards divinity must visit bengaluru,POSITIVE
much crowd good management system going bangalore always includes visiting icon temple time family wife felt crowd year gone super high way temple managed nice system thing accomodative oldie thus felt urge writing management great work,POSITIVE
good man presume owner booked u incredibly nice true communal bathroom electrical outlet different paid matter,POSITIVE
world class temple visit every time bangalore stay holy place peace mind take minimum two hour see would recommend seat main temple least minute,POSITIVE
good experience follower non follower place feel almost must visit bangalore altogether different good experience even really follower god,POSITIVE
must visit one well maintained temple located middle city visited early morning quite calm refreshing spend time family enjoy mythological story depicted http www tripadvisor showuserreviews g r icon sri rada krishna chandra temple bengaluru bangalore karnataka html,POSITIVE
wonderful two destination two one destination sense get visit temple state spiritual religious whatever case may carving get wonderful stuff eat bonus temple atmosphere full energy lot singing dancing fixed time clean well managed unlike many hindu shrine food awesome must visit bengaluru,POSITIVE
best beautiful icon temple india also offer great variety vegetarian snack food,POSITIVE
clean luxury spirituality ritual ved meditation one place perfect place worship,POSITIVE
awesome temple amazing,POSITIVE
excellent place visit place visit bangalore located near metro place nice top interior nice prasad kichadi nice many shop way inside temple business concept check timing going well maintained temple lado nice,MIXED
ok visit way make picture temple photography temple understand commercial worship,NEGATIVE
different usual religious place suitable visit family friend child good experience sunday little bit rush weekday get peace food available delicious,POSITIVE
nice place visit aesthetic calm must visit place bangalore matter believe spirituality give try,POSITIVE
great temple bangalore landmark get variety food well,POSITIVE
beautiful temple,POSITIVE
spiritual vast area city spiritual must watch visiting bangalore good place see,POSITIVE
wonderful spiritual place r allow people direct entry also get special poor entry food court many variety snack,POSITIVE
first place visit well though much impressive lot people please take care go bare foot basically temple look good though new one ancient inside suffer lot people selling different stuff sweet book candle krishna guy famous feeding poor people repeating word whole day,NEGATIVE
beautiful temple temple beautiful take picture requires take shoe old temple work visit,POSITIVE
alliance peaceful soul smoothing calming effect soul,POSITIVE
icon temple bangalore life member invited special puja birthday wedding anniversary every time visit get divine feeling also attended special festival like vykunta ekadashi janmastami even though million visit occasion arrangement superb prasad distributed devotee http www tripadvisor showuserreviews g r icon sri rada krishna chandra temple bengaluru bangalore karnataka html,POSITIVE
wonderful religious experience icon bangalore multi storied huge temple similar hare krishna temple get see mesmerizing depiction hindu god goddess environment filled hare krishna chant reverberating throughout temple complex temple generally quite crowded weekend plan hr cover temple check timing temple planning visit arti temple amazing experience may want miss prasad food delicious like icon temple,POSITIVE
temple soul fantastic place spend evening family specially bhajans take away world corruption insanity could indulge good vegetarian food also,POSITIVE
peaceful atmosphere,POSITIVE
present please,POSITIVE
good information god three krishna swamp bhagavan bangalore wonder full god,POSITIVE
iconic temple visit temple twice business trip family tour evening parti atmosphere serene place beautifully constructed decorated audience inside temple spiritual lot devotee world served best sweet dagger prasad,POSITIVE
aesthetically appealing look great especially night lighting grand structure temple get exhausting climbing way though distinct religious feel place though,NEUTRAL
perfect place peace mind often visit family definitely worth visit arti time enhancing song dancing devotee prasad visit everything great also huge cafeteria pas exiting also movie hall animated movie kid restaurant inside temple also famous food,POSITIVE
experience isbn temple premise located close yeshwantpur railway station place impeccable neat well maintained usual stream regular devotee tourist local frequent place right entrance main temple area marshal viewing statue dispersal prasad gracious gift everything proceeds uniquely orderly fashion check time listing place gate closed afternoon time remember exact timing wait bit early good experience general temple standard,POSITIVE
favorite place peaceful beautiful place three rada krishna temple jay shri krishna,POSITIVE
na best peaceful place charm something special sometimes even silence also good best loved lot,POSITIVE
life member icon frequently visit icon temple worldwide icon bangalore one best kept managed temple visited food service restaurant higher taste excellent one request management please stop using hydrogenated vegetable oil fat baked good biscuit etc sold many stall anywhere else might used food preparation temple since hydrogenated oil fat major cause heart,POSITIVE
hygiene keeping temple small shopping center also included inside temple,POSITIVE
great place explore ur visit place new come offer coupon,POSITIVE
peaceful serene hustle hustle daily chore traffic office want one evening want peace bhajans sweet fragrance around place want visit jai three krishna,POSITIVE
one tourist spot bangalore huge beautifully constructed temple good scenic view go calm n peaceful atmosphere shopping lover enjoy colourful sculpture cute lord krishna gift item n body try different kid fried item n egg le pastry also play min animated movie sit back keyboard enjoy kid n good day along,POSITIVE
super good maintenance,POSITIVE
