REVIEW,REVIEW TYPE
commercial relatively new temple big hindu version disney land quite expensive entrance temple accept religious dress code allowed enter short rent indian lung male long dress guard polite almost unfriendly one lady guard destroy expensive camera leave outside inside temple follow marked way somewhere blessed holy man everywhere stand different thing sale worst way enormous market holy souvenir different quality kit plastic thing made china holy experience looked forward disappeared commercial thing wanted money,NEGATIVE
amazing temple bangalore friend enjoyed lot icon temple one biggest temple bangalore visit,POSITIVE
well maintained temple otherworldly vibration throughout sanctuary excellent experience entry inside free annadana prasad full dinner evening ichi prasad constantly accessible,POSITIVE
temple icon temple good located west cord road rajajinagar bangalore hill god sri krishna good please visit place,POSITIVE
good place devotee believe ultimate god,POSITIVE
amazing come comfort god rejoice memory,POSITIVE
awesome,POSITIVE
visit icon spiritual person love icon great place meditation shaman wonderful temple,POSITIVE
fully commercialized place place good situated hilltop however place fully commercialized everything need money,NEGATIVE
beaten path went sightseeing three people wide unexpectedly deep atmosphere way local worship barefoot people short visit dressed cloth rental yes snack corner ant souvenir buffet restaurant extent tourist le expensive local friendly heterogeneous worship time take quite severe hour,POSITIVE
peaceful serene place spiritual temple best place peaceful serene one spend entire day place meditation bhajans,POSITIVE
huge temple kind mall isbn temple km majestic bus stop reach destination outside feel like huge temple roaming inside feel like visited kind mall temple nice doubt many thing clothes notable stuff sell experience said one time visit place must,MIXED
krishna temple hemlock beautiful serene temple lord krishna lovely calm peaceful audience also visited tourist spot tourist caste foreigner also allowed strict security dress code maintained rajajinagar bangalore india reached taxi metro closest metro station yeshwantpur,POSITIVE
peaceful well maintained looking peace mind get connected lord place visit season temple must visit bangalore,POSITIVE
place peace looking peaceful location isbn right choice little far city center worth visiting one also experience prasad loaded pure hee,POSITIVE
divine food whenever go icon bangalore please forget taste food liked quality food crowd disliked cant help,MIXED
worth visit deserves visit one come know activity isbn well organized arrangement prasad clean hygiene one buy book article item related lord krishna temple management serve food school conduct spiritual activity one rent hall function wedding,POSITIVE
neat clean temple long walk temple neat clean place plenty place around need walk uphill return walk various display temple merchandise senior visit icon managed temple definitely pleasant experience,POSITIVE
lovely temple really beautiful nice area around temple well people considerable breath taking festival time approachable really worth trip devotee tourist,POSITIVE
beautiful temple indeed great experience visiting magnificent temple definitely must visit temple lover,POSITIVE
awesome sculpture art temple well maintained many photo view entrance temple many view beautiful captured temple painting ceiling eye capturing look sculpture lord krishna rada also beautiful slowing moving exit canteen many variety food available reasonable rate nice time listening mantra temple sitting peacefully,POSITIVE
calm relaxing place looking peace visit temple commercialized well maintained idol magnificent great place meditation distribute tasty prasad well,POSITIVE
peaceful visit temple peace inside heart mind god sculpture beautifully dressed like step separated bar enter main temple best part shaman moving crowd one step chanting god krishna name,POSITIVE
highest temple generally hindu temple dark particularly moolavar like auditorium god placed good returning devotional split gone passing commercial area temple,MIXED
beautiful temple sri rada krishna temple icon wonderfully designed beautiful temple got line chant hare krishna hare krishna experience good entire family member feeling god nice prasad,POSITIVE
best temple neatly maintained organised temple must visit everyone bangalore located heart city commute easy,POSITIVE
hare krishna icon temple cord road biggest bangalore spiritual trip icon must india place spirituality devotion commitment temple puja performed something experience clean environment systematic ques marshal something amazing volunteer along guide answer query idol rada krishna alabama beautifully decorated radiated peace number book available written various author bhagawat ita life lord krishna sri prabhopadaji founder icon international society krishna consciousness restaurant serf best vegetarian food buy snake food court one place must miss bangalore,POSITIVE
higher taste icon temple bangalore excellent veg buffet many place bangalore offer fine dining exactly fine dining almost menu thoughtful kind veg starter different type rice indian indian noodle bit everything little bit fish mash tasty nevertheless attention detail refreshing dessert could imaginative pastry usual range indian sweet pretty satisfying decor presentation could fine tuned veg buffet r odd much pay conflicting opinion within group regarding madhavan air,POSITIVE
calm peace visited icon temple feel peace nice place take break daily hasty life weekday much le crowded weekend hectic,POSITIVE
hare krishna hare krishna hare krishna nice temple excellent location nice darshana lord krishna chant hare krishna hare krishna enjoyed prasad temple wonderful experience must visit bangalore,POSITIVE
hare krishna imagining visited icon family love architecture arrangement mostly delicious prasad,POSITIVE
peaceful divine relax mind visit pm lightning alliance amazing hymn relaxing expect good food,POSITIVE
place spiritually uplifting place located hill neatly kept disciplined crowd note place spiritually thrilling get excellent vegetarian food reasonable price,POSITIVE
great temple premise definitely must visit place bangalore one well maintained beautiful temple bangalore,POSITIVE
calm n serene experience amongst chaos find inner peace happiness know icon chaos meant number people visiting long queue although noisy many people around reach inside temple suddenly forget outside world,POSITIVE
hare krishna wonderful trip meet lord krishna presence dear rada krishna joyous harmony union,POSITIVE
beautiful temple away charanaravinda bhaktivedanta swami prabhupada founded isbn isbn commonly known hare krishna movement initiated thousand americansand inspire anti cult act got credit many religious scholar including thomas hopkins temple largest one inaugurated shankar ddayal sharma main shrine rada krishna beautiful decoration every day different color clothes ornament reallyastonishingt seen temple like dwaraka also priest take pain decorate dwarakeshwar seen relisted isbn temple north karnataka romaji nagar address hare krishna hill chord road romaji nagar bengaluru karnataka district bengaluru hour open pm pm phone gajastumba gold plated ft high flash shakira ft also gold plated temple arti worth watching along hare rama hare krishna everybody start dancing enjoying performance sincere prayer provide free anna ghana distribute prasadams bus route majestic kempakowda bus station isbn temple next mahalaxmi lay entrance e e mode transport available part bangalore city many marriage also conducted miss happen visit bangalore hopping,POSITIVE
better mumbai isbn please try visit lord krishna isbn temple west cross road near metro well maintained open two secession hall celebration charge nominal thanks bangalore isbn visited june,POSITIVE
divine place one biggest icon temple interior well designed place everyone visit mall orion mall near temple,POSITIVE
excellent experience muslim heard lot icon temple visited temple found peaceful place mind filled heavenly peace visited temple,POSITIVE
divine temple huge premise fabulous icon temple romaji nagar similar temple major city mumbai however size premise huge need considerable time marshal well various counter selling food item divine atmosphere one must see place bangalore included city,POSITIVE
peaceful place give peace lovely alliance inside well maintained structured lot walk,POSITIVE
modern sri krishna temple temple best place relax mind main temple peaceful chanting hare krishna hare krishna krishna krishna hare hare bhajans devotional pool marathi great get positive vibe chanting main hall must visit place bangalore time krishnastami place really good packed devotee lot chanting clean well maintained organized visit,POSITIVE
seventy divinity packed one spur moment decision visit icon temple glad made decision reached temple pm hour roam around attending parti went whole charge security check shoe luggage check going though small temple came way offering prayer made way main temple foot main temple get two way either take normal directly make way temple take way lot step like structure round robin manner supposed take one step time chant hare krishna hare krishna krishna krishna hare hare hare ram hare ram ram ram hare hare suggest go charge feel great time enter temple temple hall beautiful wonderful carving peaceful aura mesmerizing idol simply artistic waited parti divine indeed exit hall exit lane lot stall put like mini shopping complex shocked commercialization temple acceptable think coming fact even ended buying idol must visit place probably morning though evening bad either,MIXED
nice calm place uf want spend quality time peace mind go isbn temple mental peace also come spiritual atmosphere,POSITIVE
spiritual bliss icon temple offer virtually everything spiritual aspiring lovely opportunity chant mara mantra climb step receive marshal lord krishna,POSITIVE
temple solitude beautiful hindu experience religion hare rama hare krishna chant fill air essence something potent poignant reaching main temple hill top go hop coach jump exercise fun,POSITIVE
hare krishna hare rama,POSITIVE
fantastic vegetarian restaurant great spread tasty variety great snack like bridal fried also mikka food quality good audience,POSITIVE
peace mind beautiful decoration,POSITIVE
jail temple much enjoyed visit beautiful temple place local practiced ritual worship quiet place avoid weekend order avoid congestion,POSITIVE
krishna temple local resident gather carried saturday morning around clock able enter immediately free paying rupee entrance deposit shoe go barefoot middle course main hall go stair main hall people devout hindu prayer coming tourism quite place feeling inside main hall worth decoration ceiling painting beautiful first glance guess excessive expectation taboo tourist spot view time let taste atmosphere local krishna temple way little exaggerated say dress code become likely caught show shin leg regardless gender wearing short pant length last minute also say case ng lost waist passed cloth bath towel size put could shoulder seen sleeveless also ng,MIXED
temple much temple rather unusual outside inside particularly impressed entrance indian quietly passed foreign tourist stopped asked make donation rupee ignore entrance necessary leave shoe large bag backpack camera phone carry best leave valuable home,MIXED
good place devotional retreat often conduct program yoga,POSITIVE
calm mesmerizing beautiful temple nicely built kept clean greener around also well maintained must visit,POSITIVE
place peace piety inspiration indeed special place inspiring spectacular visit came early day change cleanliness attention detail sheer intensity prayer devotion,POSITIVE
nice peaceful place,POSITIVE
great experience felt blessed god resides bless divine power let feel,POSITIVE
paradise nice place every time visit anybody may spend one hour easily never make feel long one hour wide range valuable worship item make everybody fond place,POSITIVE
clean great hospitality,POSITIVE
peace hare rama hare krishna melody go ear mind enter premise nicely managed clean stand que get marshal enter temple get relaxed forget tension sit enjoy relax environment,POSITIVE
nice temple highly recommended temple bengaluru neat clean place refreshing place bengaluru,POSITIVE
calm serene place,POSITIVE
beautiful temple dedicated lord krishna bangalore icon temple imposing structure yeshwanthpura temple clean well maintained main hall beautiful idol sri krishna rada alarm descriptive painting lord birth life morning ceiling well mannered volunteer manage crowd well sanctum dedicated narasimha venkateswara must visit come bangalore,POSITIVE
essence divinity seventy single place chant aura take peaceful ride,POSITIVE
inspiring well maintained many temple north india one south personally like make different system enter main temple designed way tampering happen make chant hare krishna every step take way entire queue well managed though place getting commercialized feel fine maintain huge campus free food facility needy book item one buy souvenir place recommend place people religious belief visited september,POSITIVE
well maintained temple tourist stop temple good one time visit like shopping mall type exp,NEGATIVE
best place bangalore peace good place know radhika devi dash passed world blessing guru gouranga radhastami pm look capture face marshal sri krishna beacon u thank primate radharani,POSITIVE
peaceful place,POSITIVE
na nice place,POSITIVE
good place visit get peaceful time good place visit get peaceful time offer good food option reasonable cost,POSITIVE
magnificent clean temple icon temple bangalore really clean well maintained queue orderly sufficient parking space car temple also good satin food restaurant called higher taste really good bryan career sure carry shall pull allowed enter short shoulder le dress,POSITIVE
route guided traffic tedious long,NEGATIVE
lot stair climb temple wonderfully built architecture interior marvelous prasad served tasty wholesome thing felt miss temple high one walk lot climb many step slightly stressful aged people,MIXED
completely commercialized like temple india place highly commercialized family would love though,NEGATIVE
friend enjoying evening spending time icon temple lord krishna banana sankeerthana also lord dharshana,POSITIVE
peace within outside place within city limit hence choosing time day important prefer visit place normal day get sober marshal prasad relax time inside temple food restaurant free till pm regular day good memorabilia shop within premise parking problem,POSITIVE
amazing resplendence much like icon temple grandeur temple nothing short mesmerizing one sit keep beauty day te inside main temple breath taking stunning however something like way deliberately given angle shopping center limitless merchandise one buy really commercialized really ticket visit temple located right orion mall certainly worth time unless atheist also nice restaurant right behind temple higher taste one must try finger linking dining experience,MIXED
good view camera allowed outside food inside average like shopping mall worship allow camera outside well,NEGATIVE
calm peaceful well maintained visited several icon temple outside india temple well maintained location also good walk ease offer prayer sit relax listening chanting observe parti server really nice food nice location also get see nice sunset place get crowded weekend specially evening plan accordingly,POSITIVE
one beautiful icon temple world one bored crazy weekend party fine dine corporate colleague coming temple make feel calm peaceful,POSITIVE
beautiful must visit beautiful temple well maintained good view top food must try reasonably priced,POSITIVE
opening time pm pm pm,NEUTRAL
must visit visit icon temple enjoy food nearby restaurant also prasad inside good knowledge session sri krishna also good,POSITIVE
nice place visit least nice place visit specially friend however place avoided weekend due rush,MIXED
awesome place best time visit temple evening even though miss delicious prasad served lunch,POSITIVE
nice place,POSITIVE
visit icon bangalore wanted see beautiful architecture icon priority list prefer afternoon time rush le,POSITIVE
commercialized temple place highly commercialized seeking spiritual feel sure get still appreciate charity work done management,NEGATIVE
god meet devotee well title say place well barricade well maintained seat security personnel turn guide devotee main temple though feel little frustrating walk long way main temple reach main temple mere marshal holy god take away tireless liked way icon marketing krishna personal view place good people able walk properly balance lot push pull due huge crowd gathering free prasad counter narrow corner temple trustee may rethink moving visited temple couple time advise people chart avoid sunday special holy day since overcrowded lead track temple security seat maintain huge queue even pvt car entrance aged people although offered wheel chair service good provide seat push wheel chair well overall experience visiting place heavenly enter garcia graham main temple forget complaint beauty god word advice try avoid place overcrowded day take aged people along ca walk properly view entirely personal meant hurt anyone jai three krishna,MIXED
best place must visit reaching main gate temple rajajinagar driver guided hurry rushed main gate temple closing around pm security people allowed u inside nice peaceful environment visiting temple main hall bhajans chanting hare krishna hare rama make peaceful mind temple closed around pm coming back seen people selling photo small idol lord krishna book toy also scene fresh sweet snack selling hygiene environment launch prasad sponsored well wish krishna devotee nice relaxed refreshing mind stepping temple,POSITIVE
compared icon temple one best architecture nice place visit,POSITIVE
great mahamangalarati try make mahamangalarati around pm good experience prepared crowd much plenty stall pretty commercialized,MIXED
must place see bangalore beautiful place excellent temple picturesque location darshanam god prasad temple also variety tasty food stuff available inside temple star hotel back temple higher taste one eat hotel attached temple taste excellent food one make food prepared without garlic keep time morning darshanam classic lunch,POSITIVE
must visit least bangalore,POSITIVE
hare rama hare krishna,POSITIVE
good seen delhi icon temple well think bigger delhi temple holy place feeling relax lift food,POSITIVE
brilliant atmosphere peaceful audience,POSITIVE
liked mind blowing infra design temple also organised always ready place accommodate large crowd overall experience good found much commercialized hare krishna,MIXED
hare krishna place list devotional bend mind fact even dont visit place grand feeling place calm clean serene food option good good sweet shop price although take special pas quicker access marshal,POSITIVE
one thr attraction built top hill icon becomes much attractive day time sunlight reflection painting culture followed nice,POSITIVE
icon best peaceful place bangalore lord krishna,POSITIVE
great experience beauty divine,POSITIVE
best example architecture also positively temple good must visit bangalore,POSITIVE
nice place visit loved one family total peace mind,POSITIVE
good place proper discipline followed,POSITIVE
peaceful meditative environment,POSITIVE
calm quiet place campus lush green well organised place,POSITIVE
good temple good temple like temple nicely maintained cleanliness queue footwear bag etc good place buy thing worship like book article price reasonable food served good limited space sit eat marshal also nice,POSITIVE
beautiful temple heat city heard lot icon temple bangalore finally got chance visit beautiful temple hill overlooking city must visit,POSITIVE
must visit place awesome place experience huge temple lord made krishna temple one largest icon temple india,POSITIVE
nice neat clean well behavior piece full place like visit often,POSITIVE
temple like shopping complex peace,NEGATIVE
awesome,POSITIVE
must visit,POSITIVE
beautiful n serene always come bengaluru,POSITIVE
isbn temple bangalore usual temple part country place really good give inner peace,POSITIVE
supper,POSITIVE
great place peace tranquility closer krishna something unique isbn temple whether mumbai chennai fell love vibrant positive energy krishna chanting whole atmosphere want spend long time closer krishna great holy place must visit,POSITIVE
beautiful majestic place beautifully made place visited saturday night crowd le also liked khichdi gave prasad delicious taste,POSITIVE
another icon temple icon temple lot commercialization norm nowadays icon people like temple like anyways architecture wise pretty normal seeking peace crowd commercial stall going make tough,NEGATIVE
amazing experience,POSITIVE
made made went family amazing experience temple closed afternoon please confirm timing making plan,POSITIVE
family visit place spiritual enter feel went dad bro nice experience person coming bangalore first time must go place,POSITIVE
tourist place temple big huge variety prasad sold many tourist visit place,POSITIVE
nice place,POSITIVE
love temple much,POSITIVE
best temple city,POSITIVE
well usual part icon society located near orion mall quite good place visit submit ur slipper shoe thr reach near temple step say hare krishna hare krishna krishna krishna hare hare move one step forward rest parti tm sculpture art see water fountain dawn last prasad khichdi tasty take two haha,POSITIVE
peaceful,POSITIVE
elegant first temple visited subsequently went back time free entry follow local tourist route want real experience take time read sign help understand temple represents visited september,POSITIVE
nice architecture top stone nicely architecture temple outside inside normally little queue visit idol inside temple except special occasion like janmastami etc visiting idol one see little museum inside worth seeing buy land sweet accessory like clothes sandalwood idol calendar many stuff little commercial shop also small food court inside costly serving basis samoa sweet many stuff last prasad khichdi given every visitor,POSITIVE
nice place good temple must wikitable place family friend good maintenance maintained,POSITIVE
good place,POSITIVE
love visit always devotee good right philosophy god easy understand apply day day life made happy,POSITIVE
love visit always devotee good right philosophy god easy understand apply day day life made happy,POSITIVE
go spiritual reason good place go travel purpose comment temple huge structure usual smoothing divine aura temple however marshal slowly find temple transforming commercial center lot food shopping item place highly crowded long queue went family afternoon wait till pm gate open,NEGATIVE
mythology myth meet place even college day time went along law doubt find crowd almost time week campus clean well maintained allowed place keeping footwear something gon na lose return temple huge specially krishna rada temple enter temple thought dive divine surrounding go rational devotee feel another aspect devotion due respect prefer place visit spot much temple shopping area food court inside premise also meet temple priest teach way please god well everyone definition god devotion mine good place family without concern go miss morning parti prasad give devotee prefer preparation rather buying sweet name prasad avoid queue crowd always remember god never charge blessing human service,NEGATIVE
good place device location cleverly constructed bhajans preaching temple sure make mind peaceful,POSITIVE
divine like icon temple serene place also temple multiple floor different deity rada krishna deity beautiful like one see icon temple south indian touch attire springer also venkatesh bahai marshal breathtaking buy delicious pure vegetarian prasad temple entry awesome experience,POSITIVE
really like icon future want part icon community really trust lord krishna thank happiness life world,POSITIVE
hunting hill one place bangalore find modern temple hare krishna hill icon temple chanting hare krishna mantra keep ur soul peace well maintained temple premise must visit place,POSITIVE
nice place peace,POSITIVE
one bangalore famous landmark must visit n experience grandeur poor bhajans performed,POSITIVE
must first underline went non peak hour worth visit see place interior done well still quite large number people present non peak hour definitely better time visit see place relaxed manner visit pure veg restaurant called higher taste inside without tour place walking car entrance walk path lot,POSITIVE
peaceful,POSITIVE
divine place feel positive vibe provide tasty prasad hygiene place,POSITIVE
divine,POSITIVE
must see religious one visit marvelous architecture awesome food avoid holiday get really crowded,POSITIVE
went rainy day one beautiful temple bangalore like heaven inside temple everyone chanting mantra lord krishna loved visit,POSITIVE
hare krishna hare rama,POSITIVE
really nice place,POSITIVE
feel blissful blessed,POSITIVE
beautiful temple,POSITIVE
beautiful temple pleasant alliance place usually crowded best time day visit place sunset,POSITIVE
lavish lavish temple krishna beautiful temple building huge compound huge decoration divine beautiful lowest word lavish temple food good restaurant little away main temple watch springer decoration god statue visit evening time,POSITIVE
love place,POSITIVE
awesome place best krishna temple bangalore visited temple found ritual performed beautiful feel watch ritual performed please make visit least coming bangalore,POSITIVE
