REVIEW,REVIEW TYPE
right started job became service krishna get time book distribution preaching people krishna following prabhupada instruction chanting round hearing waiting service everyday want join devotional service,POSITIVE
good place well maintained clearest temple ever seen,POSITIVE
good visit evening,POSITIVE
lovely place,POSITIVE
famous place lord krishna good management,POSITIVE
divine new age sunday evening time parent reversing time parent taking temple taking new age temple divinity,POSITIVE
awesome peace prosperity,POSITIVE
must visit bangalore spacious well maintained temple one get opportunity see lord narasimha dev lord bahai main temple lord radhakrishna chandra built modern architecture style attracts people around country many time must visit bangalore lord marshal,POSITIVE
clean well managed charge prasad also reasonable,POSITIVE
jewel bangalore home lord krishna filled bless,POSITIVE
serene place icon temple one beautiful place bangalore well administered peaceful temple good maintenance look fabulous light sunset absolute serene,POSITIVE
beautiful peaceful place amidst chaos outside peaceful beautiful inside temple neat clean also visit landmark kitchen akshayapatra,POSITIVE
place good parking facility mark first time visitor bit difficult understand actual way see idol aged person coming advised ask temple guy lift facility available need notified appropriately,NEGATIVE
calm smoothing place calm smoothing place spend time even light look beautiful night inner temple area peaceful would love spend time market follows plus plus get everything book idol everything food snack tasty overall good place visit spend time,POSITIVE
icon went icon college project amused modern architecture glass panel traditional stone column clean peaceful premise also got chance visit akshay para kitchen preparing lunch thousand student across bangalore delightful sight http www tripadvisor showuserreviews g r icon sri rada krishna chandra temple bengaluru bangalore karnataka html,POSITIVE
harbor kolkata visited icon bangalore first day damodar month e october nice experience visit hare krishna,POSITIVE
must visit trip bengaluru temple really beautiful gold marble idol decoration around simple yet wholesome food served free devotee,POSITIVE
good temple sort facility stay food proper queue maintained serve free lunch also temple architecture good,POSITIVE
feeling blessed way go deep inside temple feel positive vibe coxless body hare rama hare krishna tune brighter mind refreshing body,POSITIVE
nice bangalore one beautiful place icon temple family every one liked view place,POSITIVE
impressive clean magnitude temple marble impressive cleanliness also refreshing change temple india,POSITIVE
commercial space temple look good along arrangement architecture stuff typical temple concept see place visit place feel like went museum rather temple lot money spent architecture decoration still good place visit get experience thing go around temple like,NEGATIVE
seventy amidst bustling city icon bangalore like peace piety amidst hustle hustle busy cosmopolitan city air call krishna even taped chant hare krishna played loop first thing strike one temple breathtaking majesty facade one beautifully designed krishna temple ever situated high hill prepared climbing stair temple command panoramic view city right side sanctum area remember dress code wear covered clothes short sleeve dress wore long params underneath cover also check temple timing go close afternoon toilet facility bit better primitive used absolute need go shoe checked shoe rack hold nose though area smell foot best part luggage counter visit temple go straight airport railway station minded step one advised stop chant complete hare krishna mantra awakening inner consciousness focusing krishna two smaller sanctum devoted prahalada prabhupada lead majestic main sanctum done gold elicit audible wow first timer onwards wouldarshan book counter exit way lead hall one purchase jaar male hindu rosario crystal tree incense essential oil whole lot thing besides lovely bakery proper cafe aptly name higher consciousness free prasad basically made sweetened tapioca pearl take leave stay longer took hour rush including chant perhaps one would better advised keep aside atleast couple hour beautiful sanctuary inner consciousness hari bol,POSITIVE
good seems institutionalized business like isbn temple one equally beautiful enhancing however something distracts commercial aspect selling product artifact right sanctum sanatorium business faith always flourished come close may go well everyone take call prepared,MIXED
rather rather wonderful icon temple take heart mind trace experience sheer bliss n peace must see possible visit rather rather,POSITIVE
must visit icon bangalore must visit fil peace mind enter main temple require list hr seen temple ye nai della nazi della must go must visit evening time,POSITIVE
religious nice place looked like commercial place religious place amazing fast food option variety finding place sit challenge weekend,POSITIVE
rather krishna like icon temple theme eye pleasing rather krishna idol long queue reach temple shop basement sell krishna idol table,POSITIVE
beautiful another one chain icon temple beautiful place lot space location height add attraction one good food hogan shaman place must visit city garden,POSITIVE
stop forcing people chant could wonderful place tourist love lord krishna represents free loving spirit cleanliness spirit place nicely created maintained food served prasad high quality jarring visitor forced chant hare rama hare krishna,NEUTRAL
experience bliss icon one best place start day trip bangalore good alliance bliss good administration neat clean good restaurant good facility dont forget enjoy sweet bold made bot shopping well add prasad also must,POSITIVE
must visit temple beautifully done exquisite idol lord krishna breathtaking view hill situated visitor friendly easy differently enabled people visit clean well managed wish important temple serene well managed inspire many devotee visiting daily must visit bangalore,POSITIVE
get hope high rating see bangalore rated one top thing confusing yes temple beautiful photo allowed temple spend time ushered endless shop actual worship area whole thing felt like money grab prosecuting ploy see expect highlight time bangalore,NEGATIVE
loving atmosphere peaceful evening view city damn good,POSITIVE
wonderful experience enjoyed non devotee visit bangalore colleague offered take piston never heard went idea expect visitor india suggest hiring reliable driver even cab driver already ridden leaving place could potential nightmare confusion reviewer claimed person mediates known hare krishna temple arrived might agreed go immediately upon arrival moved beauty temple increased moved many step various stage ritual observation completely activated good sense word every step rather busy bustling place top chose sit floor close eye try silent still mind suddenly twenty minute later host lightly tapped shoulder suggested might time u start heading back twenty minute flown instant think could sat another hour two someone would normally would definitely go back plenty see along way beautiful carving monumental architecture leaving handed portion rice spaced amazing combination spice wish could duplicate home suspect cardomam cinnamon maybe love ala unable replicate home visited hard really describe magic place loved,MIXED
great divine place love atmosphere healthy climb till top audience near fountain great good parking facility,POSITIVE
crowd yet away good place visit whatever spiritual faith enjoy whole atmosphere spirituality fertility bi festival one life enjoy fullest,POSITIVE
good visit good architecture beautiful idol good temple alliance exit place commercialized,NEUTRAL
built nicely top small hill surroundings good extremely crowded requires lot walking,NEGATIVE
jai ho,POSITIVE
divinity grandeur cleanliness festivity charity mind bowling variety cuisine astonishing affordable price icon legend three krishna janmashtami celebration attract lakh devotee every year,POSITIVE
posh great look impeccable discipline getting caught modernization branding devotion spirituality run profitable business though,NEGATIVE
hhh temple clean well maintained especially bangalore city standard photography prohibited quickly sneak shot two mobile memory espionage found temple commercialized assume purpose upkeep recommend must see site tourist expect anything extravagant taj medal,POSITIVE
peaceful place,POSITIVE
truly beautiful magnificent,POSITIVE
beautiful spiritual place amongst best krishna isbn temple huge prepared walk good distance centrally located city good parking space good restaurant evening tea dos quiet professional temple r lane going get ample option buy reading stuff food item decent price,POSITIVE
beautiful temple beautiful temple tourist metro station near canteen facility,POSITIVE
long queue could manage visit beautiful temple magnificiently dressed rada krishna idol evening time great crowd keeping patience following system could manage visit temple,POSITIVE
icon temple visited icon temple aug earlier visited twice temple made modern architecture facility providing peace go inside good devotee crowd management hare rama hare krishna one step innovative enter main temple filled religious faith feel peace inside inside temple prasad book many thing available sale inside temple many statue lord krishna people worship return way get shoe back deposited entering inside get free prasad also http www tripadvisor showuserreviews g r icon sri rada krishna chandra temple bengaluru bangalore karnataka html,POSITIVE
hara rama hara krishna huge temple inside lot shop,POSITIVE
look like business centre several icon mandir life never get essence commercialization found area big inside temple like icon temple shiny clean decorated interior lovely idol sri krishna rada god goddess sitting statue sri prabhupada icon temple distinguishes bangalore temple icon temple number shop inside many look like religious shopping mall painful eye see business oriented approach icon temple actually habituated thing per experience icon temple jay sri krishna jay radhhe,NEGATIVE
spiritual good location extremely serene best part mara earth become one lord make sure go evening,POSITIVE
magnificent icon temple bangalore hare krishna hare krishna krishna krishna hare hare hare rama hare rama rama rama hare hare one beautiful well organised clean temple ever visited friendly staff lift elderly people physically challenged people must visit sort divine blessing,POSITIVE
icon temple bangalore must visit icon temple located rajajinagar one biggest icon temple world part charitable society objective propagating krishna consciousness temple got fixed timing visit closed pm pm free distribution prasad visiting hour readable road metro must visit location bangalore,POSITIVE
best spiritual place best place lord krishna devotee ban performed get blessing form lord krishna,POSITIVE
great sri krishna temple unique temple temple premise neat clean sri krishna vigraha attracting devotee mediate temple premise number philosophical book available different book prima bhagavadgita also available commentary english hindi kannada telugu language free prasad available good quality lunch also available reasonable price variety snack available must visit place bangalore,POSITIVE
chant hare krishna beautiful temple fact one beautiful icon temple magnificent structure rich stall selling varied book souvenir etc luxurious spread prasad area selling variety indian western prasad item,POSITIVE
hare krishna temple great view ritual performing daily basis accommodation member available food different level variety line hygiene quality,POSITIVE
three tiered temple visit lovely huge temple complex pay parking pay enter pay get closer altar fair love love chanting biggest sanctum glorious ceiling painted go see,MIXED
sure one best destination fabulous place good tribute lord shri krishna,POSITIVE
beautiful like place space parking steep stair exhausted wait long front although timing right,POSITIVE
holy place,POSITIVE
place tradition peace,POSITIVE
wonderful feel visited icon family always used pas used wonder big ya real real big peaceful one walk lot marshal peace mind forget walk coming marshal greeted mouth watering dish beautiful portrait lord krishna childhood one definitely visit icon temple,POSITIVE
awesome experience ca thought inside gate temple big blessed,POSITIVE
crowded outside bliss inside usually bangalore every place crowded weekend temple busy queue main abode could take anywhere min sunny day could tad tiring start good arrangement securing slipper also opt locker secure valuable though prefer carry except mobile phone almost body part day also need secured locker climb step reach top hill main abode hall krishna temple bhajans meditation first feeling like wow feel bliss energy like minded people one thing praying trying connect inner self thing notice cleanliness greener outstanding think truly believe cleanliness next holiness forget collect prasadams way shop way sell lot literature lord krishna shop religious fancy purchase service provide akshayapatra foundation part akshayapatra service csr company cant tell fulfilling see free mid day meal service served deserving kid across india part inquirer overall excellent truly blissful experience,POSITIVE
bangalore hill nice place near orion mall shop pray mall temple located place experience metro journey evening snack amazing,POSITIVE
hare ram,POSITIVE
temple really special give peace mind poor performed treat eye view ba,POSITIVE
nice peaceful memorable place visited temple bangalore try avoid peak day festival really want explore place different traditional temple lot souvenir shop make sure compare price purchasing visited place november cooling,POSITIVE
biggest krishna temple bangalore,POSITIVE
beautiful place peaceful great place chanting easy reach one best temple india ever visited,POSITIVE
must visit place bangalore nice temple like small hemlock enter feel vibration sanctity great marshal come across various handicraft icon related item followed mouth watering house made dish vegetarian miss time,POSITIVE
really beautiful temple beautiful well maintained temple premise spotlessly clean even festival day everything well organised marshal ordeal elsewhere one favourite place worship many bangloreans,POSITIVE
beautiful temple feel closer god loved visit temple felt closer almighty well managed cooperative helpful staff volunteer make visit especially elder peaceful comfortable much preference given big shot asking money anywhere contribute voluntarily purchasing thing shop complex group many elder staff supported u letting u bring vehicle top using lift good arrangement senior even crowded day beautiful math data bring held,POSITIVE
divine visit beautiful hindu temple also try food available watch movie show temple try going arti time evening divine,POSITIVE
marshal husband good temple always like much visit icon temple bhajans good people sit bhajans never think leaving place,POSITIVE
magnificent transcendental service lord amazing golden shrine,POSITIVE
interesting crowd hot buy ticket stand queue bring sock must take shoe remember place leave shoe,NEUTRAL
interesting temple visit impressive temple building especially beautiful lighted night participated puja ate temple lunch friend book sale area people willing answer question religious practice,POSITIVE
cleanliness audience well maintained place diversity meet culture wen come place worship,POSITIVE
peace full overtime visit though place highly commercialized service run justified place host many tiny delight aura food served delicious,POSITIVE
mesmerizing beauty krishna temple made hill magnificent idol krishna god associated place sit peacefully chanting krishna ram name please indulge money related activity,POSITIVE
clean peaceful religion place free enter clean peaceful good spend hour learn hindu religion need remove ur shoe place bag hindsight beware crowd festival,POSITIVE
beautiful temple lord krishna temple well maintained well decorated bright sanctum visitor made walk around stall sell isbn merchandise make like walk shopping mall place worship,POSITIVE
atmosphere place quite nice weakness level best worth visiting,POSITIVE
mall rather temple build temple earn money everywhere created stall path around stall ave pas though stall peace delhi icon temple better,NEGATIVE
quite impressive helpful staff explaining religion,POSITIVE
amazing cultural experience lot time let converge know get quick line unless planning worship ideal,POSITIVE
slice indian culture really good ceremony inside see way interior temple several hindi god interesting experience different culture european culture entry price cheap go inside take shoe let entry bag,POSITIVE
nice place icon sri radhakrishna chandra temple one largest temple world beautiful place listed place nice see place enjoyed lot,POSITIVE
modern temple modern temple present bore visited thousand people everyday temple look beautiful area big,POSITIVE
interesting surprising ceremony went morning marshal worship interesting see people dancing singing never seen kind worship quite impressive temple interesting thought big architecture really spectacular like ancient temple ceremony lasted minute nothing free http www tripadvisor showuserreviews g r icon sri rada krishna chandra temple bengaluru bangalore karnataka html,POSITIVE
blissful temple commercialized icon huge temple lord krishna beautifully blissful main sannidhi go chanting hare rama hare krishna step sannidhi absolutely amazing sit evening parti shop many thing become commercialized wear solar preferably leave footwear car two hotel property,MIXED
worth seeing saw took part celebration european attraction necessarily visit,POSITIVE
unique experience beautiful structural design unique culture prior going inside temple leave footwear designated area forget get number claim footwear later tip make visit convenient memorable wear proper attire like pant long skirt find visitor area pay necessary fee avoid long queue spend time looking main area people worship dance bring cash buy religious toy food souvenir item inside temple,POSITIVE
chant way temple went parent january year nice place peace mind start queue hand slipper pay get bucket puja samaghri get temple try step way get temple step chant word written paper give sit inside collect prasad coming food different decorating material god statue clothes http www tripadvisor showuserreviews g r icon sri rada krishna chandra temple bengaluru bangalore karnataka html,POSITIVE
peaceful visit,POSITIVE
peaceful place good temple gone wid friend nice place hangout wid find much devotion,POSITIVE
higher taste really higher visited icon temple restaurant named higher taste delight vegetarian buffet spread large bountiful lot career variety unlimited indian western styled sweet cooked pure spiritual atmosphere aim food prasad offering god profit motive even food left end day distributed charity interested god n prasad stuff work finger linking awesome vegetarian food price go feel difference,POSITIVE
interesting came unintentionally pleasant surprised complex quite huge clean well maintained free enter walk around popular temple site devotion stunning nice visit especially since right middle bustling city overall really enjoyed visit even got little discussion priest trying quite desperately convince u buy book krishna let put end visit indulge local delicacy,POSITIVE
nice place fancy beautiful temple top level temple bottom level food giftshop,POSITIVE
interesting place photo allowed icon temple interesting place visit although disappointed picture allowed inside also due location temple take time get usually lot traffic way,POSITIVE
commercial divine temple fully commercialized huge money appears spent develop temple unfortunately whether performing puja selling many table garb prasad even soliciting devotee purchase book higher cost main hall job place sanctity,NEGATIVE
icon bangalore icon different place worship especially garden city bangalore seater caller struggle crowd one usually famous shrine fact waited queue sunday lunch actually prasad,POSITIVE
one beautiful temple bangalore icon temple bangalore one city beautiful temple situated hill time parti enjoy chant bhajans happen time must visit place bangalore,POSITIVE
heavenly interested krishna miss world biggest hare krishna temple clean bright inspiring place puja prayer,POSITIVE
hare rama hare krishna temple quite huge take lot time get entry statue lord krishna quite big prasad tasty,POSITIVE
great audience icon temple certainly must point view religious significance audience restaurant add charm visitor one would advised go quieter know le hot heat could since one sol,POSITIVE
religion ontmoet commerce van de temple die ik bezocht heb dit verreweg de grootste ik er op code vrijdag een write dag india en de belangstelling overweldigend met zijn viewed london voor copy een vip pa open daarmee heb je met maximal personen toegang tot de temple en word je om de risen geneid en risen er na tree kleine temple kom je erect wat ik de hoofdtempel nomen wie de ri gestion left nu eindelijk bij zijn aangekomen win werden verwezen naar een wachtruimte en verzocht te gain bitten uiteindelijk stone lak voor het altar priestess werden dear een ritual op en dana green een bloom voor chter het ondanks dat ik van de religion went een indrukwekkende evading minded von ik wat dana kam niet de title van wat hare krishna nu inhoudt mar wel de enzyme hoeveelheid stand met merchandise professional voetbalclub er wat van runner self ben ik nog opgevoed met het van jesus die de handelaren de temple uit song de opbrengst sclient wel naar een good te gain mar de gemiddeld er een uitvloeisel van al met al tech wel een spiritual evading wel ik bli met het advise van one chauffeur om de schooner vast de auto te later voor min level scheelde dat een hoop geo na floor,POSITIVE
peaceful atmosphere dummy food loved khichdi bakery item snack yes got bit overboard food really sattvik damn tasty atmosphere peaceful despite huge rush weekend decor temple also great krishna look lovely always rather mesmerising prasad please go eat must try,POSITIVE
beautiful temple extremely commercial beautiful temple inside leave main inside area walk many table shopping area overwhelming expect vendor selling good temple experience worth seeing true spiritual serene experience due massive shopping area,MIXED
modern modern made marble organized take shoe hand every indian temple allows entry barefoot take shoe hand charge garde let keep purse backpack unpleasant smell recording krishna rare end patience anyone end tour guard force go shop,MIXED
clean nice temple one must see place bangalore clean well maintained temple nice place mediate time overall nice place wit requirement,POSITIVE
good place crowd,POSITIVE
impressive huge impressive temple high bangalore take camera wear short pulled line dressed doi temple busy went opened afternoon queue quite long worth wait,POSITIVE
great experience,POSITIVE
nice temple mantra jolly top temple nice big snack nice,POSITIVE
awesome place get peace mind eat lot tasty food,POSITIVE
nice view,POSITIVE
awesome,POSITIVE
well maintained order beautiful temple one must visit bangalore,POSITIVE
go mara mantra hare ram hare ram hare krishna hare krishna time beautiful place,POSITIVE
temple futuristic model numerous occasion compelled family regular devotee temple indeed beautiful huge certainly well done however biggest let institution might commercial model always crowded take hour get sanctum personal opinion intent hurt anyone feeling write though ardent devotee thing cant connect people pay get vip easy access marshal something connect said salute cause akshay para well conducted,MIXED
serene tranquil want tranquility please visit place rid self ur sin done present life r bangalore dont visit place r definitely missing something big visited september,POSITIVE
temple part amazing half building shopping complex,MIXED
beautiful well maintained krishna temple india must visit walking temple premise amazed operated amount investment hard work dedication people resulting great krishna temple every thing temple nice must visit place one visit bangalore maintenance upkeep immaculate well trained organised devotee everywhere guide u main deity krishna rada delight dharshan see unlike traditional temple india mainly south india many restriction except enter foot wear photography allowed main sanctum honest get vibration normally get traditional temple south india may wrong know may looked tourist many counter inside selling many item connected temple book photo doll sculpture sweet snack many decorative item house,POSITIVE
nice peaceful,POSITIVE
good,POSITIVE
important temple bangalore,POSITIVE
icon temple bangalore good tourist attraction would recommend people fit walk,MIXED
hare krishna,POSITIVE
peaceful nice place get thing god blessing peaceful environment good place go family maintaining good manner,POSITIVE
visit abode almighty must visit place live bangalore visit city abode almighty universe spin span everywhere,POSITIVE
like mahavishnu photo prayer,POSITIVE
god krishna,POSITIVE
good,POSITIVE
fantastic temple cant take photo definately must see photo allowed ca share friend culturally must probably spectacular temple bangalore located built area close one main shopping district,MIXED
device pleasure one best isbn temple across india divine marshal lord krishna fill soul purity prasad distributed within temple choice indian favourite sweet available paid basis finger linking good,POSITIVE
serene place really fantastic place visit serene peaceful clean unlike temple,POSITIVE
